{
  "$schema": "./sage-agent.schema.json",
  "rlm": {
    "enabled": true,
    "cache_dir": ".rlm_cache",
    "cache_ttl": 3600
  },
  "providers": {
    "openai": {
      "model": "gpt-4"
    },
    "anthropic": {
      "model": "claude-3-sonnet-20240229"
    }
  },
  "opencode": {
    "plugin_enabled": true
  },
  "claude_code": {
    "mcp_enabled": true
  }
}
